### ISSUE TITLE
out_forward reopens connection on any send attempt

### ISSUE THREAD

**Issue by szhem** [fluent/fluentd#263]
Hi there,

It seems, that out_forward plugin opens a new connection every time it has any data to send.

Here is the tcpdump that shows that connection has been opened twice while sending two separate log messages by means of forwarding

```
No.     Time        Source                Destination           Protocol Length Info
  3 3.490657    127.0.0.1             127.0.0.1             TCP      74     53174 > 5140 [SYN] Seq=0 Win=32792 Len=0 MSS=16396 SACK_PERM=1 TSval=24954460 TSecr=0 WS=32
  4 3.490687    127.0.0.1             127.0.0.1             TCP      74     5140 > 53174 [SYN, ACK] Seq=0 Ack=1 Win=32768 Len=0 MSS=16396 SACK_PERM=1 TSval=24954460 TSecr=24954460 WS=32
  5 3.490707    127.0.0.1             127.0.0.1             TCP      66     53174 > 5140 [ACK] Seq=1 Ack=1 Win=32800 Len=0 TSval=24954460 TSecr=24954460
  6 3.490885    127.0.0.1             127.0.0.1             TCP      67     53174 > 5140 [PSH, ACK] Seq=1 Ack=1 Win=32800 Len=1 TSval=24954460 TSecr=24954460
  7 3.490903    127.0.0.1             127.0.0.1             TCP      66     5140 > 53174 [ACK] Seq=1 Ack=2 Win=32768 Len=0 TSval=24954460 TSecr=24954460
  8 3.490932    127.0.0.1             127.0.0.1             TCP      73     53174 > 5140 [PSH, ACK] Seq=2 Ack=1 Win=32800 Len=7 TSval=24954460 TSecr=24954460
  9 3.490945    127.0.0.1             127.0.0.1             TCP      66     5140 > 53174 [ACK] Seq=1 Ack=9 Win=32768 Len=0 TSval=24954460 TSecr=24954460
 10 3.490971    127.0.0.1             127.0.0.1             TCP      71     53174 > 5140 [PSH, ACK] Seq=9 Ack=1 Win=32800 Len=5 TSval=24954460 TSecr=24954460
 11 3.490983    127.0.0.1             127.0.0.1             TCP      66     5140 > 53174 [ACK] Seq=1 Ack=14 Win=32768 Len=0 TSval=24954460 TSecr=24954460
 12 3.491006    127.0.0.1             127.0.0.1             TCP      169    53174 > 5140 [PSH, ACK] Seq=14 Ack=1 Win=32800 Len=103 TSval=24954460 TSecr=24954460
 13 3.491019    127.0.0.1             127.0.0.1             TCP      66     5140 > 53174 [ACK] Seq=1 Ack=117 Win=32768 Len=0 TSval=24954460 TSecr=24954460
 14 3.491079    127.0.0.1             127.0.0.1             TCP      66     53174 > 5140 [FIN, ACK] Seq=117 Ack=1 Win=32800 Len=0 TSval=24954460 TSecr=24954460
 15 3.520961    127.0.0.1             127.0.0.1             TCP      66     5140 > 53174 [FIN, ACK] Seq=1 Ack=118 Win=32768 Len=0 TSval=24954468 TSecr=24954460
 16 3.520998    127.0.0.1             127.0.0.1             TCP      66     53174 > 5140 [ACK] Seq=118 Ack=2 Win=32800 Len=0 TSval=24954468 TSecr=24954468

 29 64.559417   127.0.0.1             127.0.0.1             TCP      74     53175 > 5140 [SYN] Seq=0 Win=32792 Len=0 MSS=16396 SACK_PERM=1 TSval=24969727 TSecr=0 WS=32
 30 64.559450   127.0.0.1             127.0.0.1             TCP      74     5140 > 53175 [SYN, ACK] Seq=0 Ack=1 Win=32768 Len=0 MSS=16396 SACK_PERM=1 TSval=24969727 TSecr=24969727 WS=32
 31 64.559497   127.0.0.1             127.0.0.1             TCP      66     53175 > 5140 [ACK] Seq=1 Ack=1 Win=32800 Len=0 TSval=24969727 TSecr=24969727
 32 64.559718   127.0.0.1             127.0.0.1             TCP      67     53175 > 5140 [PSH, ACK] Seq=1 Ack=1 Win=32800 Len=1 TSval=24969728 TSecr=24969727
 33 64.559730   127.0.0.1             127.0.0.1             TCP      66     5140 > 53175 [ACK] Seq=1 Ack=2 Win=32768 Len=0 TSval=24969728 TSecr=24969728
 34 64.559751   127.0.0.1             127.0.0.1             TCP      73     53175 > 5140 [PSH, ACK] Seq=2 Ack=1 Win=32800 Len=7 TSval=24969728 TSecr=24969728
 35 64.559759   127.0.0.1             127.0.0.1             TCP      66     5140 > 53175 [ACK] Seq=1 Ack=9 Win=32768 Len=0 TSval=24969728 TSecr=24969728
 36 64.559776   127.0.0.1             127.0.0.1             TCP      71     53175 > 5140 [PSH, ACK] Seq=9 Ack=1 Win=32800 Len=5 TSval=24969728 TSecr=24969728
 37 64.559785   127.0.0.1             127.0.0.1             TCP      66     5140 > 53175 [ACK] Seq=1 Ack=14 Win=32768 Len=0 TSval=24969728 TSecr=24969728
 38 64.559800   127.0.0.1             127.0.0.1             TCP      192    53175 > 5140 [PSH, ACK] Seq=14 Ack=1 Win=32800 Len=126 TSval=24969728 TSecr=24969728
 39 64.559808   127.0.0.1             127.0.0.1             TCP      66     5140 > 53175 [ACK] Seq=1 Ack=140 Win=32768 Len=0 TSval=24969728 TSecr=24969728
 40 64.559851   127.0.0.1             127.0.0.1             TCP      66     53175 > 5140 [FIN, ACK] Seq=140 Ack=1 Win=32800 Len=0 TSval=24969728 TSecr=24969728
 41 64.599710   127.0.0.1             127.0.0.1             TCP      66     5140 > 53175 [ACK] Seq=1 Ack=141 Win=32768 Len=0 TSval=24969738 TSecr=24969728
 42 64.600228   127.0.0.1             127.0.0.1             TCP      66     5140 > 53175 [FIN, ACK] Seq=1 Ack=141 Win=32768 Len=0 TSval=24969738 TSecr=24969728
 43 64.600261   127.0.0.1             127.0.0.1             TCP      66     53175 > 5140 [ACK] Seq=141 Ack=2 Win=32800 Len=0 TSval=24969738 TSecr=24969738
```

Is it possible to keep the connection open up to the connection failure and reconnect attempt to the backup server?

Kind Regards,
Sergey
