### DISCUSSION TITLE
Windows Logs Not Forwarded to Aggregator

### DISCUSSION THREAD

**Discussion by peredoc** [fluent/fluentd#4910] [Q&A]
### What is a problem?

Greetings,

I'm trying to setup windows log forwarding but the logs are not getting sent to the aggregator. I can see the logs getting written to the fluentd.log file but I don't see them getting written to the winlog.json file. Referencing https://github.com/fluent/fluentd/discussions/4844, I do see that the RecordId value changes. Has anyone experienced this or is there something obvious that is misconfigured? 

### Describe the configuration of Fluentd

**Forwarder .conf file**
```
<source>
  @type windows_eventlog2
  @id windows_eventlog2
  channels wec-iis
  read_existing_events true
  tag winevt.raw
  <storage>
    @type "local"
    persistent true
    path C:\logs\winlog.json
  </storage>
</source>

<match winevt.raw>
  @type stdout
</match>

<match winevt.raw>
  @type forward
  @id forward
  require_ack_response
  <server>
    host xxx
    port 24224
  </server>
</match>

<system>
  log_level trace
</system>
```

**Aggregator .conf file**
```
<source>
  @type forward
  @id input_forward
  bind 0.0.0.0
  port 24224
</source>

<match winevt.raw>
  @type copy
  <store>
    @type file
    path /var/log/fluent/winevt.raw
    <buffer>
      @type file
      path /var/log/fluent/buffer/winevt.raw
      chunk_limit_size 256m
      total_limit_size 10g
      flush_interval 5s
    </buffer>
    <secondary>
      @type file
      path /var/log/fluent/secondary/winevt.raw
    </secondary>
    <log>
      time_slice_format %Y%m%d%H
      time_slice_wait 10m
      time_slice_interval 1h
      rotate_wait 60m
    </log>
    <retry>
      max_interval 30
      retry_limit 17
    </retry>
  </store>
  <store>
    @type stdout
  </store>
</match>

<system>
  workers 4
</system>

```
### Describe the logs of Fluentd

There are no errors on both the forwarder and aggregator. tcpdump on the aggregator shows a connection but no data is getting transferred 

xxx@xxx:~$ sudo tcpdump -i any src xxx and dst port 24224 -vv
tcpdump: data link type LINUX_SLL2
tcpdump: listening on any, link-type LINUX_SLL2 (Linux cooked v2), snapshot length 262144 bytes
09:15:09.715524 ens160 In  IP (tos 0x2,ECT(0), ttl 127, id 15234, offset 0, flags [DF], proto TCP (6), length 52)
    xxx.64221 >xxx.24224: Flags [SEW], cksum 0xd49c (correct), seq 2619797126, win 64240, options [mss 1460,nop,wscale 8,nop,nop,sackOK], length 0
09:15:09.715901 ens160 In  IP (tos 0x0, ttl 127, id 15235, offset 0, flags [DF], proto TCP (6), length 40)
   xxx.64221 > xxx.24224: Flags [.], cksum 0x4b8c (correct), seq 2619797127, ack 3403340454, win 8195, length 0
09:15:09.715976 ens160 In  IP (tos 0x0, ttl 127, id 15236, offset 0, flags [DF], proto TCP (6), length 40)
    xxx.64221 > xxx.24224: Flags [F.], cksum 0x4b8b (correct), seq 0, ack 1, win 8195, length 0
09:15:10.714275 ens160 In  IP (tos 0x2,ECT(0), ttl 127, id 15237, offset 0, flags [DF], proto TCP (6), length 52)
    xxx.64222 > xxx.24224: Flags [SEW], cksum 0xe3b7 (correct), seq 1928857753, win 64240, options [mss 1460,nop,wscale 8,nop,nop,sackOK], length 0
09:15:10.714673 ens160 In  IP (tos 0x0, ttl 127, id 15238, offset 0, flags [DF], proto TCP (6), length 40)
    xxx.64222 > xxx.24224: Flags [.], cksum 0x82e9 (correct), seq 1928857754, ack 2167143443, win 8195, length 0
09:15:10.714922 ens160 In  IP (tos 0x0, ttl 127, id 15239, offset 0, flags [DF], proto TCP (6), length 40)
   xxx.64222 >xxx.24224: Flags [F.], cksum 0x82e8 (correct), seq 0, ack 1, win 8195, length 0
^C
6 packets captured
11 packets received by filter
0 packets dropped by kernel

### Environment

```markdown
On the forwarder
- Fluentd version: 1.18.9
- TD Agent version:
- Fluent Package version: 5.2.0
- Docker image (tag):
- Operating system: Windows Server 2022
- Kernel version: 10.0.20348.3453
```

**Comment by ashie** [comment]
> Forwarder .conf file

> ```
> <match winevt.raw>
>   @type stdout
> </match>
> ```

Please remove this section and try again.
Multiple `match` section won't be matched, only the first one will be effective.
If you want multiple output, use `copy` plugin.

**Comment by peredoc** [comment]
Greetings! Thank you for the reply @ashie. I removed that section in the forwarder .conf file but I'm not seeing a difference. The winlog.json file contains the below one liner only, but the RecordId changes. Tcpdump on the aggregator is still showing no data and I'm also not seeing the winevt.raw file getting created in the /var/log/fluent directory. As a test, the permissions on the c:\logs directory are wide open but same behavior. Anything else you would recommend looking at?

`{"wec-iis":"<BookmarkList>\r\n  <Bookmark Channel='WEC-IIS' RecordId='131346935' IsCurrent='true'/>\r\n</BookmarkList>"}`
